{
  "schema_version": "1.0.0",
  "match_id": "m291",
  "league_id": "fl",
  "season_id": "2026",
  "matchday": 30,
  "seed": 2028310507,
  "kickoff_local": "2027-03-06T12:30:00",
  "stadium": "Kilnside Park",
  "referee": "Priya Halvorsen",
  "weather": {
    "condition": "overcast",
    "temperature_c": 18.4,
    "wind_kmh": 7.1
  },
  "home": {
    "team_id": "ash",
    "formation": "4-3-3",
    "starting": [
      {
        "player_id": "ash-01",
        "slot": "GK"
      },
      {
        "player_id": "ash-02",
        "slot": "RB"
      },
      {
        "player_id": "ash-04",
        "slot": "RCB"
      },
      {
        "player_id": "ash-05",
        "slot": "LCB"
      },
      {
        "player_id": "ash-03",
        "slot": "LB"
      },
      {
        "player_id": "ash-06",
        "slot": "DM"
      },
      {
        "player_id": "ash-08",
        "slot": "RCM"
      },
      {
        "player_id": "ash-10",
        "slot": "LCM"
      },
      {
        "player_id": "ash-07",
        "slot": "RW"
      },
      {
        "player_id": "ash-09",
        "slot": "ST"
      },
      {
        "player_id": "ash-11",
        "slot": "LW"
      }
    ],
    "bench": [
      "ash-12",
      "ash-13",
      "ash-14",
      "ash-15",
      "ash-16",
      "ash-17",
      "ash-18"
    ]
  },
  "away": {
    "team_id": "brk",
    "formation": "4-2-3-1",
    "starting": [
      {
        "player_id": "brk-01",
        "slot": "GK"
      },
      {
        "player_id": "brk-02",
        "slot": "RB"
      },
      {
        "player_id": "brk-04",
        "slot": "RCB"
      },
      {
        "player_id": "brk-05",
        "slot": "LCB"
      },
      {
        "player_id": "brk-03",
        "slot": "LB"
      },
      {
        "player_id": "brk-06",
        "slot": "RDM"
      },
      {
        "player_id": "brk-08",
        "slot": "LDM"
      },
      {
        "player_id": "brk-07",
        "slot": "RAM"
      },
      {
        "player_id": "brk-10",
        "slot": "CAM"
      },
      {
        "player_id": "brk-14",
        "slot": "LAM"
      },
      {
        "player_id": "brk-17",
        "slot": "ST"
      }
    ],
    "bench": [
      "brk-12",
      "brk-13",
      "brk-15",
      "brk-16",
      "brk-18"
    ]
  },
  "home_attacks_in_period_1": "+x",
  "stakes": {
    "derby": true,
    "notes": [
      "Ashmere are 1st on 53 points",
      "A win keeps Ashmere top",
      "Brackenford are 11th on 42 points",
      "Local derby",
      "Marrow (Ashmere) is one booking from a ban",
      "Gorrow (Brackenford) is one booking from a ban",
      "Dunanu (Brackenford) is suspended",
      "Kestade (Brackenford) is suspended"
    ]
  },
  "pre_match_win_prob": {
    "home": 0.48,
    "draw": 0.253,
    "away": 0.267
  }
}
